{
  "$schema": "https://json-schema.org/draft/2020-12/schema",
  "$id": "https://schemas.impresari-context.invalid/v1/macos-local-vm-vulnerability-review-profile.schema.json",
  "title": "ADR-0087 macOS local-VM vulnerability review profile",
  "type": "object",
  "additionalProperties": false,
  "required": ["schema_name", "schema_version", "profile_id", "profile_version", "guest_release_manifest_digest", "upstream_authentication_record_digest", "assessment_record_path", "assessment_record_digest", "evidence_provenance_path", "evidence_provenance_digest", "required_checks", "controls"],
  "properties": {
    "schema_name": {"const": "macos-local-vm-vulnerability-review-profile"},
    "schema_version": {"const": "1.0.0"},
    "profile_id": {"const": "iar-macos-local-vm-vulnerability-review-v1"},
    "profile_version": {"const": "1.0.0"},
    "guest_release_manifest_digest": {"const": "sha256:02e5ba57ef2bb3be02cef4e978d3e518ec39a5db014988036164d2821e19b7e6"},
    "upstream_authentication_record_digest": {"const": "sha256:f1ef35d52427a15179777bafd67eddd2e545c8e853ddc425377544732b955476"},
    "assessment_record_path": {"const": "platform/macos-vm-feasibility/guest-vulnerability-assessment.json"},
    "assessment_record_digest": {"const": "sha256:823d6100d5e0fa7ecee84c4a41bbc5ada63a3e2e1df8bce854a0543c65afdcd8"},
    "evidence_provenance_path": {"const": "platform/macos-vm-feasibility/guest-vulnerability-evidence-provenance.json"},
    "evidence_provenance_digest": {"const": "sha256:d43b534b2aec9e37400907b032fd5f950392cafa7212cafe8d966085ad822b7c"},
    "required_checks": {"type": "array", "minItems": 8, "maxItems": 8, "uniqueItems": true, "items": {"type": "string", "pattern": "^[a-z0-9-]+$"}},
    "controls": {
      "type": "object", "additionalProperties": false,
      "required": ["network_access_during_routine_validation", "review_performed", "candidate_current", "replacement_required", "advisory_coverage_complete", "vulnerability_assessment_complete", "production_admitted", "analyzer_execution", "authority_added"],
      "properties": {
        "network_access_during_routine_validation": {"const": false},
        "review_performed": {"const": true},
        "candidate_current": {"const": false},
        "replacement_required": {"const": true},
        "advisory_coverage_complete": {"const": false},
        "vulnerability_assessment_complete": {"const": false},
        "production_admitted": {"const": false},
        "analyzer_execution": {"const": false},
        "authority_added": {"const": false}
      }
    }
  }
}
