{
  "schema_name": "macos-local-vm-vulnerability-review-profile",
  "schema_version": "1.0.0",
  "profile_id": "iar-macos-local-vm-vulnerability-review-v1",
  "profile_version": "1.0.0",
  "guest_release_manifest_digest": "sha256:02e5ba57ef2bb3be02cef4e978d3e518ec39a5db014988036164d2821e19b7e6",
  "upstream_authentication_record_digest": "sha256:f1ef35d52427a15179777bafd67eddd2e545c8e853ddc425377544732b955476",
  "assessment_record_path": "platform/macos-vm-feasibility/guest-vulnerability-assessment.json",
  "assessment_record_digest": "sha256:823d6100d5e0fa7ecee84c4a41bbc5ada63a3e2e1df8bce854a0543c65afdcd8",
  "evidence_provenance_path": "platform/macos-vm-feasibility/guest-vulnerability-evidence-provenance.json",
  "evidence_provenance_digest": "sha256:d43b534b2aec9e37400907b032fd5f950392cafa7212cafe8d966085ad822b7c",
  "required_checks": [
    "exact-candidate-identity",
    "exact-upstream-authentication",
    "exact-provider-snapshot-digests",
    "current-package-version-compared",
    "advisory-coverage-disclosed",
    "stale-candidate-denied",
    "replacement-required",
    "no-admission-overclaim"
  ],
  "controls": {
    "network_access_during_routine_validation": false,
    "review_performed": true,
    "candidate_current": false,
    "replacement_required": true,
    "advisory_coverage_complete": false,
    "vulnerability_assessment_complete": false,
    "production_admitted": false,
    "analyzer_execution": false,
    "authority_added": false
  }
}
